<!ELEMENT destinations (destination+)>
<!ELEMENT destination (name,location,estimatedCost,durationHours)>
<!ATTLIST destination id ID #REQUIRED>
<!ELEMENT name (#PCDATA)>
<!ELEMENT location (#PCDATA)>
<!ELEMENT estimatedCost (#PCDATA)>
<!ELEMENT durationHours (#PCDATA)>
